{
  "opendb_id": "adc13455-e455-4f67-943b-4a55dcb26891",
  "connectors": {
    "atx_24_pin": 1,
    "eps_8_pin": 1,
    "pcie_12vhpwr": 0,
    "pcie_6_plus_2_pin": 0,
    "sata": 6,
    "molex_4_pin": 3,
    "floppy_4_pin": 0
  },
  "metadata": {
    "name": "Silverstone Strider ATX 400W Non-Modular 80+ Bronze Certified",
    "manufacturer": "Silverstone",
    "part_numbers": [
      "ST40F-ESB"
    ],
    "series": "Strider",
    "variant": "400W Bronze"
  },
  "wattage": 400,
  "form_factor": "ATX",
  "efficiency_rating": "80+ Bronze",
  "modular": "Non-Modular",
  "color": [],
  "length": 140,
  "fanless": false,
  "general_product_information": {}
}