{
  "opendb_id": "a8e3d0d9-fcf9-4e81-83c1-ea8e747cfac6",
  "connectors": {
    "atx_24_pin": 1,
    "eps_8_pin": 2,
    "pcie_12vhpwr": 1,
    "pcie_6_plus_2_pin": 2,
    "sata": 8,
    "molex_4_pin": 3,
    "floppy_4_pin": 0
  },
  "metadata": {
    "name": "Silverstone Extreme 850R Black SFX 850W Fully Modular 80+ Platinum",
    "manufacturer": "Silverstone",
    "part_numbers": [
      "SST-EX850R-PM"
    ],
    "series": "Extreme",
    "variant": "850W "
  },
  "wattage": 850,
  "form_factor": "SFX",
  "efficiency_rating": "",
  "modular": "Full",
  "color": [
    "BLACK"
  ],
  "length": 100,
  "fanless": false,
  "general_product_information": {
    "amazon_sku": "B0BQCV927S",
    "newegg_sku": "2AM-006F-001E1",
    "walmart_sku": 2875759223
  }
}