{
  "opendb_id": "7645443f-55bf-42c8-9979-86388473434f",
  "connectors": {
    "atx_24_pin": 1,
    "eps_8_pin": 2,
    "pcie_12vhpwr": 0,
    "pcie_6_plus_2_pin": 4,
    "sata": 8,
    "molex_4_pin": 5,
    "floppy_4_pin": 0
  },
  "metadata": {
    "name": "Super Flower Golden Green HX 650W Non-Modular 80+ Gold",
    "manufacturer": "Super Flower",
    "part_numbers": [
      "SF-650P14XE (HX)"
    ],
    "series": "Golden",
    "variant": "650W Gold"
  },
  "wattage": 650,
  "form_factor": "ATX",
  "efficiency_rating": "80+ Gold",
  "modular": "Non-Modular",
  "color": [],
  "length": 145,
  "fanless": false,
  "general_product_information": {}
}