{
  "opendb_id": "8a610fb0-f4ba-419e-a2c9-573ae196d48d",
  "connectors": {
    "atx_24_pin": 1,
    "eps_8_pin": 2,
    "pcie_12vhpwr": 1,
    "pcie_6_plus_2_pin": 3,
    "sata": 8,
    "molex_4_pin": 2,
    "floppy_4_pin": 0
  },
  "metadata": {
    "name": "Deepcool PN650M White 650W Fully Modular 80+ Gold Certified ATX",
    "manufacturer": "Deepcool",
    "part_numbers": [
      "R-PN650M-FC0W-US                                                    R-PN650M-FC0W-UK                                                    PN650M WH                                                    R-PN650M-FC0W-EU                                                    R-PN650M-FC0W-WO"
    ],
    "series": "PN650M",
    "variant": "650W Gold"
  },
  "wattage": 650,
  "form_factor": "ATX",
  "efficiency_rating": "80+ Gold",
  "modular": "Full",
  "color": [
    "WHITE"
  ],
  "length": 140,
  "fanless": false,
  "general_product_information": {}
}