{
  "opendb_id": "5f8b09ad-c4e9-4700-a07f-a623831811d0",
  "connectors": {
    "atx_24_pin": 1,
    "eps_8_pin": 0,
    "pcie_12vhpwr": 0,
    "pcie_6_plus_2_pin": 0,
    "sata": 8,
    "molex_4_pin": 0,
    "floppy_4_pin": 0
  },
  "metadata": {
    "name": "Corsair RM750 ATX 750W Fully Modular 80+ Gold Certified",
    "manufacturer": "Corsair",
    "part_numbers": [
      "RM750                                                    CP-9020055-UK                                                    CP-9020055-WW                                                    CP-9020055-NA                                                    CP-9020055-EU"
    ],
    "series": "RM750",
    "variant": "750W Gold"
  },
  "wattage": 750,
  "form_factor": "ATX",
  "efficiency_rating": "80+ Gold",
  "modular": "Full",
  "color": [],
  "length": 180,
  "fanless": false,
  "general_product_information": {}
}