{
  "opendb_id": "e9e5b95c-9344-4769-92ac-c837aebfda02",
  "connectors": {
    "atx_24_pin": 1,
    "eps_8_pin": 1,
    "pcie_12vhpwr": 0,
    "pcie_6_plus_2_pin": 4,
    "sata": 6,
    "molex_4_pin": 6,
    "floppy_4_pin": 0
  },
  "metadata": {
    "name": "Zalman zm-650-XG ATX 650W Semi-Modular 80+ Gold Certified",
    "manufacturer": "Zalman",
    "part_numbers": [
      "zm-650-XG"
    ],
    "series": "zm-650-XG",
    "variant": "650W Gold"
  },
  "wattage": 650,
  "form_factor": "ATX",
  "efficiency_rating": "80+ Gold",
  "modular": "Semi-Modular",
  "color": [],
  "length": 180,
  "fanless": false,
  "general_product_information": {}
}