{
  "opendb_id": "0c297025-d0a0-4991-ab6f-8c6222670c76",
  "connectors": {
    "atx_24_pin": 1,
    "eps_8_pin": 1,
    "pcie_12vhpwr": 0,
    "pcie_6_plus_2_pin": 2,
    "sata": 5,
    "molex_4_pin": 4,
    "floppy_4_pin": 0
  },
  "metadata": {
    "name": "Thermaltake Litepower 600W Non-Modular",
    "manufacturer": "Thermaltake",
    "part_numbers": [
      "W0355RA"
    ],
    "series": "Litepower",
    "variant": "600W "
  },
  "wattage": 600,
  "form_factor": "ATX",
  "efficiency_rating": "",
  "modular": "Non-Modular",
  "color": [],
  "length": 140,
  "fanless": false,
  "general_product_information": {}
}