{
  "opendb_id": "bc202566-a16c-4786-8125-6b96315f2de0",
  "connectors": {
    "atx_24_pin": 1,
    "eps_8_pin": 0,
    "pcie_12vhpwr": 0,
    "pcie_6_plus_2_pin": 0,
    "sata": 8,
    "molex_4_pin": 0,
    "floppy_4_pin": 0
  },
  "metadata": {
    "name": "Segotep GM Black 850W Fully Modular 80+ Gold Certified",
    "manufacturer": "Segotep",
    "part_numbers": [
      "CP-PSU-ST-GM850"
    ],
    "series": "GM",
    "variant": "850W Gold"
  },
  "wattage": 850,
  "form_factor": "ATX",
  "efficiency_rating": "80+ Gold",
  "modular": "Full",
  "color": [
    "BLACK"
  ],
  "length": 140,
  "fanless": false,
  "general_product_information": {
    "amazon_sku": "B08F1NFSG4",
    "newegg_sku": "9SIBGX1JA26863",
    "walmart_sku": 304094942
  }
}