{
  "opendb_id": "ca3b849b-5bae-47fc-a080-fafa84c2351f",
  "connectors": {
    "atx_24_pin": 1,
    "eps_8_pin": 0,
    "pcie_12vhpwr": 0,
    "pcie_6_plus_2_pin": 0,
    "sata": 2,
    "molex_4_pin": 4,
    "floppy_4_pin": 0
  },
  "metadata": {
    "name": "FSP Group ATX400-PNT ATX 400W Non-Modular",
    "manufacturer": "FSP Group",
    "part_numbers": [
      "ATX400-PNT"
    ],
    "series": "ATX400-PNT",
    "variant": "400W "
  },
  "wattage": 400,
  "form_factor": "ATX",
  "efficiency_rating": "",
  "modular": "Non-Modular",
  "color": [],
  "length": null,
  "fanless": false,
  "general_product_information": {}
}