{
  "opendb_id": "f5a276d7-8b35-42c1-aa70-9e2bd863868b",
  "connectors": {
    "atx_24_pin": 1,
    "eps_8_pin": 0,
    "pcie_12vhpwr": 0,
    "pcie_6_plus_2_pin": 0,
    "sata": 8,
    "molex_4_pin": 0,
    "floppy_4_pin": 0
  },
  "metadata": {
    "name": "Silverstone Triton 1000Rz Black 1000W Fully Modular",
    "manufacturer": "Silverstone",
    "part_numbers": [
      "SST-TR1000R-GM"
    ],
    "series": "Triton",
    "variant": "1000W "
  },
  "wattage": 1000,
  "form_factor": "ATX",
  "efficiency_rating": "",
  "modular": "Full",
  "color": [
    "BLACK"
  ],
  "length": 140,
  "fanless": false,
  "general_product_information": {}
}