{
  "opendb_id": "f413ab9f-a039-405b-94e6-910ec4bf650a",
  "connectors": {
    "atx_24_pin": 1,
    "eps_8_pin": 1,
    "pcie_12vhpwr": 0,
    "pcie_6_plus_2_pin": 2,
    "sata": 5,
    "molex_4_pin": 4,
    "floppy_4_pin": 0
  },
  "metadata": {
    "name": "LEPA B550-MB 550W Semi-Modular 80+ Bronze Certified",
    "manufacturer": "LEPA",
    "part_numbers": [
      "B550-MB"
    ],
    "series": "B550-MB",
    "variant": "550W Bronze"
  },
  "wattage": 550,
  "form_factor": "ATX",
  "efficiency_rating": "80+ Bronze",
  "modular": "Semi-Modular",
  "color": [],
  "length": 160,
  "fanless": false,
  "general_product_information": {}
}