{
  "opendb_id": "45213438-9ebc-4b14-beea-e999008ebc5c",
  "connectors": {
    "atx_24_pin": 1,
    "eps_8_pin": 1,
    "pcie_12vhpwr": 0,
    "pcie_6_plus_2_pin": 4,
    "sata": 10,
    "molex_4_pin": 8,
    "floppy_4_pin": 0
  },
  "metadata": {
    "name": "G.Skill PS750G ATX 750W Fully Modular 80+ Gold Certified",
    "manufacturer": "G.Skill",
    "part_numbers": [
      "GP-GD750A-CWV1"
    ],
    "series": "PS750G",
    "variant": "750W Gold"
  },
  "wattage": 750,
  "form_factor": "ATX",
  "efficiency_rating": "80+ Gold",
  "modular": "Full",
  "color": [
    "BLACK"
  ],
  "length": 180,
  "fanless": false,
  "general_product_information": {}
}