{
  "opendb_id": "1dd17bac-4eef-4a6b-8b4c-a0b08cb6550c",
  "connectors": {
    "atx_24_pin": 1,
    "eps_8_pin": 2,
    "pcie_12vhpwr": 0,
    "pcie_6_plus_2_pin": 4,
    "sata": 10,
    "molex_4_pin": 5,
    "floppy_4_pin": 0
  },
  "metadata": {
    "name": "SeaSonic Platinum 760W Fully Modular 80+ Platinum",
    "manufacturer": "SeaSonic",
    "part_numbers": [
      "SS-760XP2"
    ],
    "series": "Platinum",
    "variant": "760W Platinum"
  },
  "wattage": 760,
  "form_factor": "ATX",
  "efficiency_rating": "80+ Platinum",
  "modular": "Full",
  "color": [],
  "length": 160,
  "fanless": false,
  "general_product_information": {}
}